{
  "schema_version": "1.0.0",
  "id": "bangladeshi-medicinal-plant-leaves-7",
  "slug": "bangladeshi-medicinal-plant-leaves-7",
  "name": "A Real-World Leaf Image Dataset of Seven Bangladeshi Medicinal Plant Species",
  "description": "A curated collection of 13,095 leaf images (6,700 raw and 6,395 pre-processed) across seven medicinal plant species native to Bangladesh, photographed in outdoor natural environments across varying lighting conditions for species identification and morphological plant analysis.",
  "homepage_url": "https://data.mendeley.com/datasets/mk6chdc5c8/1",
  "publisher": {
    "name": "Daffodil International University",
    "type": "academic",
    "url": "https://daffodilvarsity.edu.bd"
  },
  "modalities": [
    "vision"
  ],
  "tasks": [
    "image-classification",
    "plant-identification"
  ],
  "tags": [
    "computer-vision",
    "agriculture",
    "plant-identification",
    "medicinal-plants",
    "leaves"
  ],
  "license": {
    "status": "verified_open",
    "name": "CC BY 4.0",
    "spdx_id": "CC-BY-4.0",
    "url": "https://creativecommons.org/licenses/by/4.0/",
    "commercial_use": "allowed",
    "notes": "Published on Mendeley Data under Creative Commons Attribution 4.0 International (CC BY 4.0)."
  },
  "source_references": [
    {
      "title": "Mendeley Data Repository (Version 1)",
      "url": "https://data.mendeley.com/datasets/mk6chdc5c8/1",
      "type": "repository",
      "notes": "Official repository for version 1 published on 2026-04-17."
    },
    {
      "title": "Mendeley Data DOI Citation Link",
      "url": "https://doi.org/10.17632/mk6chdc5c8.1",
      "type": "documentation",
      "notes": "Canonical DOI citation link."
    }
  ],
  "verification": {
    "status": "verified",
    "verified_by": "OpenDatasets Core Team",
    "verified_date": "2026-10-29",
    "notes": "Verified against Mendeley Data v1 and DataCite DOI 10.17632/mk6chdc5c8.1."
  },
  "size": {
    "file_formats": [
      "jpg",
      "png",
      "zip"
    ],
    "status": "unknown",
    "notes": "13,095 total leaf images (6,700 raw and 6,395 pre-processed)."
  },
  "sample_count": {
    "total": 13095,
    "splits": {
      "raw_images": 6700,
      "preprocessed_images": 6395
    },
    "unit": "images",
    "status": "verified"
  },
  "dates": {
    "published": "2026-04-17"
  },
  "citation": {
    "paper_title": "A real-world leaf image dataset of seven Bangladeshi medicinal plant species",
    "paper_url": "https://doi.org/10.17632/mk6chdc5c8.1",
    "authors": [
      "Shabnur Anonna Akhy",
      "Shabnaj Tamanna Shetu",
      "Md. Sakib Arman Santo",
      "Mayen Uddin Mojumdar",
      "Narayan Ranjan Chakraborty"
    ],
    "doi": "10.17632/mk6chdc5c8.1",
    "bibtex": "@misc{akhy2026sevenplants,\n  title={A real-world leaf image dataset of seven Bangladeshi medicinal plant species},\n  author={Akhy, Shabnur Anonna and Shetu, Shabnaj Tamanna and Santo, Md. Sakib Arman and Mojumdar, Mayen Uddin and Chakraborty, Narayan Ranjan},\n  year={2026},\n  publisher={Mendeley Data},\n  doi={10.17632/mk6chdc5c8.1}\n}"
  },
  "geographic_coverage": [
    "Bangladesh"
  ],
  "provenance": {
    "collection_method": "Photographed in natural outdoor environments (fields, nurseries, gardens) across Bangladesh.",
    "curation_notes": "Segmented into raw and segmented preprocessed subsets across seven medicinal species."
  }
}
