{
  "schema_version": "1.0.0",
  "id": "inaturalist-2021",
  "slug": "inaturalist-2021",
  "name": "iNaturalist 2021 Competition Dataset",
  "description": "A premier fine-grained biodiversity dataset curated by Caltech, Cornell Tech, and the iNaturalist community for the FGVC8 workshop at CVPR 2021. Features 10,000 species of organisms from across the tree of life (plants, insects, birds, mammals, fungi, reptiles, amphibians, and mollusks). Contains over 2.7 million images in total, including a carefully curated mini-split with 50 training images per class to benchmark balanced fine-grained visual classification at extreme taxonomy scale.",
  "homepage_url": "https://github.com/visipedia/inat_comp/tree/master/2021",
  "publisher": {
    "name": "Caltech, Cornell Tech & iNaturalist",
    "type": "academic",
    "url": "https://www.inaturalist.org"
  },
  "modalities": [
    "vision"
  ],
  "tasks": [
    "fine-grained-classification",
    "image-classification",
    "species-identification"
  ],
  "tags": [
    "fine-grained",
    "biodiversity",
    "species",
    "inaturalist",
    "visipedia",
    "fgvc"
  ],
  "license": {
    "status": "verified_non_commercial",
    "name": "Creative Commons Attribution-NonCommercial (Dataset)",
    "spdx_id": null,
    "url": "https://github.com/visipedia/inat_comp/tree/master/2021",
    "commercial_use": "forbidden",
    "notes": "Individual images licensed under diverse CC licenses by iNaturalist community members; competition set curated for non-commercial research."
  },
  "source_references": [
    {
      "title": "iNaturalist 2021 Competition Repository",
      "url": "https://github.com/visipedia/inat_comp/tree/master/2021",
      "type": "repository",
      "notes": "Official FGVC8 competition repo with metadata JSON files, download links, and evaluation metrics."
    },
    {
      "title": "The iNaturalist Species Classification and Detection Dataset",
      "url": "https://doi.org/10.1109/CVPR.2018.00914",
      "type": "original_paper",
      "notes": "Foundational paper published in IEEE/CVF Conference on Computer Vision and Pattern Recognition (CVPR 2018)."
    }
  ],
  "verification": {
    "status": "verified",
    "verified_by": "OpenDatasets Core Team",
    "verified_date": "2026-10-30",
    "notes": "Verified against Visipedia GitHub repository and CVPR FGVC workshop benchmarks."
  },
  "size": {
    "amount": 340.0,
    "unit": "GB",
    "file_formats": [
      "jpg",
      "json"
    ],
    "status": "estimated",
    "notes": "Large-scale RGB image tar archives and COCO-style JSON annotation files. (Estimated distribution payload size based on publisher documentation; independent byte-level archive download verification was not performed in catalog curation.)"
  },
  "sample_count": {
    "total": 2729500,
    "splits": {
      "train": 2686843,
      "val": 100000,
      "species": 10000
    },
    "unit": "images",
    "status": "verified"
  },
  "dates": {
    "published": "2021-03-01"
  },
  "citation": {
    "paper_title": "The iNaturalist Species Classification and Detection Dataset",
    "paper_url": "https://doi.org/10.1109/CVPR.2018.00914",
    "authors": [
      "Grant Van Horn",
      "Oisin Mac Aodha",
      "Yang Song",
      "Alexander Shepard",
      "Pietro Perona",
      "Serge Belongie"
    ],
    "doi": "10.1109/CVPR.2018.00914",
    "bibtex": "@inproceedings{vanhorn2018inaturalist,\n  title={The iNaturalist species classification and detection dataset},\n  author={Van Horn, Grant and Mac Aodha, Oisin and Song, Yang and Shepard, Alexander and Hart, Adam and Perona, Pietro and Belongie, Serge},\n  booktitle={IEEE Conference on Computer Vision and Pattern Recognition (CVPR)},\n  pages={8769--8778},\n  year={2018},\n  doi={10.1109/CVPR.2018.00914}\n}"
  }
}
