{
  "schema_version": "1.0.0",
  "id": "bangla-human-ai-text-classification",
  "slug": "bangla-human-ai-text-classification",
  "name": "Bangla Human & AI Text Classification Dataset",
  "description": "A balanced dataset of 6,000 Bengali text samples (3,000 human-written and 3,000 AI-generated) designed for binary classification of synthetic and natural human writing in Bengali. Each sample includes source text, binary label, and character/word length metadata.",
  "homepage_url": "https://data.mendeley.com/datasets/tvtm9tkvdn/1",
  "publisher": {
    "name": "Independent Academic Researcher (Abir Mahmud Shahariar)",
    "type": "individual"
  },
  "modalities": [
    "nlp"
  ],
  "tasks": [
    "text-classification",
    "ai-generated-text-detection"
  ],
  "tags": [
    "nlp",
    "bangla",
    "ai-detection",
    "classification"
  ],
  "license": {
    "status": "verified_open",
    "name": "CC BY 4.0",
    "spdx_id": "CC-BY-4.0",
    "url": "https://creativecommons.org/licenses/by/4.0/",
    "commercial_use": "allowed",
    "notes": "Published on Mendeley Data under Creative Commons Attribution 4.0 International (CC BY 4.0)."
  },
  "source_references": [
    {
      "title": "Mendeley Data Repository (Version 1)",
      "url": "https://data.mendeley.com/datasets/tvtm9tkvdn/1",
      "type": "repository",
      "notes": "Official repository for version 1 published on 2026-08-03."
    },
    {
      "title": "Mendeley Data DOI Citation Link",
      "url": "https://doi.org/10.17632/tvtm9tkvdn.1",
      "type": "documentation",
      "notes": "Canonical DOI citation link."
    }
  ],
  "verification": {
    "status": "verified",
    "verified_by": "OpenDatasets Core Team",
    "verified_date": "2026-10-29",
    "notes": "Verified against Mendeley Data v1 and DataCite DOI 10.17632/tvtm9tkvdn.1."
  },
  "size": {
    "file_formats": [
      "csv"
    ],
    "status": "unknown",
    "notes": "6,000 balanced records across human and AI text classes."
  },
  "sample_count": {
    "total": 6000,
    "splits": {
      "human": 3000,
      "ai_generated": 3000
    },
    "unit": "samples",
    "status": "verified"
  },
  "languages": [
    "bn"
  ],
  "dates": {
    "published": "2026-08-03"
  },
  "citation": {
    "paper_title": "Bangla Human & Ai Text Classification",
    "paper_url": "https://doi.org/10.17632/tvtm9tkvdn.1",
    "authors": [
      "Abir Mahmud Shahariar"
    ],
    "doi": "10.17632/tvtm9tkvdn.1",
    "bibtex": "@misc{shahariar2026banglahumanai,\n  title={Bangla Human & Ai Text Classification},\n  author={Shahariar, Abir Mahmud},\n  year={2026},\n  publisher={Mendeley Data},\n  doi={10.17632/tvtm9tkvdn.1}\n}"
  },
  "geographic_coverage": [
    "Bangladesh"
  ],
  "provenance": {
    "collection_method": "Human texts scraped and extracted from Bengali content; AI texts synthesized using generative language models.",
    "curation_notes": "Balanced 3,000 human and 3,000 AI samples formatted with token length statistics."
  }
}
