{
  "schema_version": "1.0.0",
  "id": "bangla-grammar-qa",
  "slug": "bangla-grammar-qa",
  "name": "Bangla Grammar QA: Question Answering with Prerequisite Knowledge and Multi-Stage Hints",
  "description": "A specialized Bangla grammar question-answering dataset containing 10,000 manually curated instances developed for educational NLP, intelligent tutoring systems, hint-based learning, and language model evaluation. Derived from the official National Curriculum and Textbook Board (NCTB) secondary Bangla grammar textbook, each instance provides questions, reference answers, prerequisite grammatical concepts, multi-stage hints, and hint convergence scores.",
  "homepage_url": "https://data.mendeley.com/datasets/tsdvtzwwpn/1",
  "publisher": {
    "name": "American International University-Bangladesh",
    "type": "academic",
    "url": "https://www.aiub.edu"
  },
  "modalities": [
    "nlp"
  ],
  "tasks": [
    "question-answering",
    "educational-nlp"
  ],
  "tags": [
    "nlp",
    "bangla",
    "grammar",
    "question-answering",
    "education"
  ],
  "license": {
    "status": "verified_open",
    "name": "CC BY 4.0",
    "spdx_id": "CC-BY-4.0",
    "url": "https://creativecommons.org/licenses/by/4.0/",
    "commercial_use": "allowed",
    "notes": "Published on Mendeley Data under Creative Commons Attribution 4.0 International (CC BY 4.0)."
  },
  "source_references": [
    {
      "title": "Mendeley Data Repository (Version 1)",
      "url": "https://data.mendeley.com/datasets/tsdvtzwwpn/1",
      "type": "repository",
      "notes": "Official repository for version 1 published on 2026-09-03."
    },
    {
      "title": "Mendeley Data DOI Citation Link",
      "url": "https://doi.org/10.17632/tsdvtzwwpn.1",
      "type": "documentation",
      "notes": "Canonical DOI citation link."
    }
  ],
  "verification": {
    "status": "verified",
    "verified_by": "OpenDatasets Core Team",
    "verified_date": "2026-10-29",
    "notes": "Verified against Mendeley Data v1 and DataCite DOI 10.17632/tsdvtzwwpn.1."
  },
  "size": {
    "file_formats": [
      "csv",
      "json"
    ],
    "status": "unknown",
    "notes": "Contains 10,000 structured question-answering instances."
  },
  "sample_count": {
    "total": 10000,
    "unit": "instances",
    "status": "verified"
  },
  "languages": [
    "bn"
  ],
  "dates": {
    "published": "2026-09-03"
  },
  "citation": {
    "paper_title": "A Bangla Grammar Question Answering Dataset with Prerequisite Knowledge, Multi-Stage Hints, and Hint Convergence Scores",
    "paper_url": "https://doi.org/10.17632/tsdvtzwwpn.1",
    "authors": [
      "Rahul Chandra Shil",
      "Jahidul Islam Shakib",
      "Utsab Kumar Saha"
    ],
    "doi": "10.17632/tsdvtzwwpn.1",
    "bibtex": "@misc{shil2026banglaqa,\n  title={A Bangla Grammar Question Answering Dataset with Prerequisite Knowledge, Multi-Stage Hints, and Hint Convergence Scores},\n  author={Shil, Rahul Chandra and Shakib, Jahidul Islam and Saha, Utsab Kumar},\n  year={2026},\n  publisher={Mendeley Data},\n  doi={10.17632/tsdvtzwwpn.1}\n}"
  },
  "geographic_coverage": [
    "Bangladesh"
  ],
  "provenance": {
    "collection_method": "Curated from the official National Curriculum and Textbook Board (NCTB) secondary Bangla grammar curriculum.",
    "curation_notes": "Annotated with prerequisite knowledge concepts, multi-stage instructional hints, and convergence scores."
  }
}
