{
  "schema_version": "1.0.0",
  "id": "bangla-tense",
  "slug": "bangla-tense",
  "name": "BanglaTense: A Large-Scale Dataset of Bangla Sentences Categorized by Tense",
  "description": "BanglaTense is a comprehensive NLP classification dataset of 17,819 annotated Bengali sentences categorized across grammatical tenses: 5,629 past tense, 6,101 present tense, and 6,089 future tense. The dataset is designed to facilitate research into syntactic parsing, tense identification, and linguistic analysis in low-resource Bengali NLP.",
  "homepage_url": "https://data.mendeley.com/datasets/39w5khrg87/4",
  "publisher": {
    "name": "Daffodil International University",
    "type": "academic",
    "url": "https://daffodilvarsity.edu.bd"
  },
  "modalities": [
    "nlp"
  ],
  "tasks": [
    "text-classification",
    "tense-classification"
  ],
  "tags": [
    "nlp",
    "bangla",
    "linguistics",
    "tense",
    "syntax"
  ],
  "license": {
    "status": "verified_open",
    "name": "CC BY 4.0",
    "spdx_id": "CC-BY-4.0",
    "url": "https://creativecommons.org/licenses/by/4.0/",
    "commercial_use": "allowed",
    "notes": "Published on Mendeley Data under Creative Commons Attribution 4.0 International (CC BY 4.0)."
  },
  "source_references": [
    {
      "title": "Mendeley Data Repository (Version 4)",
      "url": "https://data.mendeley.com/datasets/39w5khrg87/4",
      "type": "repository",
      "notes": "Official repository for version 4 published on 2025-01-15."
    },
    {
      "title": "Mendeley Data DOI Citation Link",
      "url": "https://doi.org/10.17632/39w5khrg87.4",
      "type": "documentation",
      "notes": "Canonical DOI citation link."
    }
  ],
  "verification": {
    "status": "verified",
    "verified_by": "OpenDatasets Core Team",
    "verified_date": "2026-10-29",
    "notes": "Verified against Mendeley Data v4 and DataCite DOI 10.17632/39w5khrg87.4."
  },
  "size": {
    "file_formats": [
      "csv",
      "xlsx"
    ],
    "status": "unknown",
    "notes": "Contains 17,819 annotated sentences across three balanced classes."
  },
  "sample_count": {
    "total": 17819,
    "splits": {
      "past": 5629,
      "present": 6101,
      "future": 6089
    },
    "unit": "sentences",
    "status": "verified"
  },
  "languages": [
    "bn"
  ],
  "dates": {
    "published": "2025-01-15"
  },
  "citation": {
    "paper_title": "BanglaTense: A Large-Scale Dataset of Bangla Sentences Categorized by Tense: Past, Present, and Future",
    "paper_url": "https://doi.org/10.17632/39w5khrg87.4",
    "authors": [
      "Umme Ayman",
      "Md Hasan Imam Bijoy",
      "Md. Monarul Islam Mithu"
    ],
    "doi": "10.17632/39w5khrg87.4",
    "bibtex": "@misc{ayman2025banglatense,\n  title={BanglaTense: A Large-Scale Dataset of Bangla Sentences Categorized by Tense: Past, Present, and Future},\n  author={Ayman, Umme and Bijoy, Md Hasan Imam and Mithu, Md. Monarul Islam},\n  year={2025},\n  publisher={Mendeley Data},\n  doi={10.17632/39w5khrg87.4}\n}"
  },
  "geographic_coverage": [
    "Bangladesh"
  ],
  "provenance": {
    "collection_method": "Extracted and annotated from diverse Bengali language texts and grammar resources.",
    "curation_notes": "Preprocessed and manually verified across three tense categories (past, present, future)."
  }
}
